,summary,severity
2307,All buttons should have an ID,minor
2308,Classification should not appear in new bugmail when useclassification = 0,minor
2309,graphviz-gd missing on landfill (dependency graphs broken),major
2310,Release Notes no longer need upgrading instructions,minor
2311,Code error thrown when resolving bug as duplicate of a bug the reporter cannot see,major
2312,Remove useless code from colchange.cgi,trivial
2313,Release Notes for Bugzilla 2.22.5,blocker
2314,Login cookies should be created as SSL-only on installations that require SSL,major
2315,"Boolean chart contains the phrase ""contains regexp"" when it should say ""matches regexp""",trivial
2316,help for query.cgi does not work properly on IE6,minor
2317,"Minor JS cleanup for the ""edit multiple bugs"" page",minor
2318,"With the Dusk theme, the cursor hovering rows in buglists is displayed as a pointer despite rows are not clickable",minor
2319,PostgresSQL: Upgrade of Testopia results in error near the end of checksetup.pl,major
2322,Wrong index for the series table,minor
2323,Highlight shared searches in userprefs.cgi,minor
2324,"Hide ""Add to footer"" checkboxes when not sharing a saved searches",minor
2325,"The word ""Severity"" is hard coded; not all pages use field_descs.bug_severity",trivial
2326,"The word ""Platform"" is hard coded; not all pages use field_descs.rep_platform",trivial
2327,Dates before 1901 fail validation,minor
2328,Comment headers don't really need ------ in them and should be re-ordered,minor
2329,[Classification] should not be next to bug ID and short_desc in the show_bug header,minor
2331,Link to the bug in the bug header/title bar includes a space,trivial
2332,Voting help page is out-of-date,trivial
2333,"On bug creation, the bug status with the lowest sortkey is chosen for users without editbugs/canconfirm privs, even when UNCONFIRMED is valid",critical
2334,"Remove my name after ""including you"" when CCed to a bug",minor
2335,noscript: no link to duplicate target bug,minor
2336,Taint error in _check_dup_id(),critical
2337,"The status selector is too far from the comment box, leading to a serious usability problem",major
2338,The dashed border next to the line numbers in the Diff Viewer can be visually jarring,minor
2339,request.cgi crashes if a flag modification date is invalid,critical
2340,A user with no privs who reported a bug cannot move it to another product if the target milestone is set,major
2341,"English string ""Created an attachment"" in localized installations",minor
2342,"In <field.js>, ""Warning: assignment to undeclared variable bz_alias_check_array""",minor
2343,"The ""Importance"" label in show_bug.cgi should point to the severity and priority descriptions",minor
2344,enter_bug (New Bug) UI bounces up and down when you change the component because description changes height,minor
2345,Bug pages no longer added to bfcache due to unload listener on Window,major
2346,"Do not display ""Help"" links in the banner/footer when docs_urlbase is empty",minor
2347,describecomponents.cgi throws warning of uninitialized value when viewing undefined product/component,minor
2348,"Documentation about ""Boolean charts"" talks about ""equals"" and so, while these choices have been renamed",trivial
2349,Problem with sending data via email,major
2350,"Change the ""Name and Password"" tab to be ""Account Information"" (as password may or may not be changeable)",minor
2351,The requestee field should be narrower,minor
2352,Installation docs should recommend using package management instead of CPAN,minor
2354,token.cgi should reject password change requests for disabled accounts,minor
2355,"Emails have no header to indicate that they are auto-generated, and so get auto-responses",minor
2356,Extra space included in hyperlink to commenter mailto,trivial
2357,Mass bug edit form for buglist.cgi shows inactive bug statuses in drop down,minor
2359,Users with editbugs privs cannot edit a duplicate anymore if it points to a bug you cannot see,critical
2360,Foreign Key names can be too long as currently designed,minor
2361,Diff lines overlapping in long lines,minor
2362,"""My Requests"" link no longer displayed in the footer of some pages (attachment.cgi diff mode, page.cgi)",minor
2363,The URL to the dependency graph is wrong when using an external webdot server,major
2365,[Oracle] Windows installation may need additional documentation,minor
2366,Guided bug entry creates public bugs. Expected it to have same group membership defaults as using non-guided method.,minor
2367,Can not mark a bug as duplicate,minor
2368,checksetup.pl instructions to install missing Perl modules are hardcoded in english,minor
2369,The dependency tree is not a valid HTML5 page,minor
2371,How to create a private attachment in enter_bug.cgi not obvious,minor
2372,"Account creation page uses word ""accountname"" - should be ""account name""",trivial
2373,"When I try to close a resolved bug, getting error 'Legal Version Not Set'",major
2374,"Release Bugzilla 3.2rc2, 3.0.6, 2.22.6, and 2.20.7",blocker
2375,"Remove ""Show every bug in the system with dependencies"" in dependency graphs",minor
2376,"Security Advisory for Bugzilla 3.2rc2, 3.0.6, 2.22.6, and 2.20.7",blocker
2377,Compiling buglist.cgi in Bugzilla 2.22.5+ with Perl 5.10 throws a warning,minor
2378,Release Notes for Bugzilla 3.0.6,blocker
2379,"[Mysql] ""Use of uninitialized value"" when doing checksetup.pl the first time.",minor
2380,Release Notes for 2.22.6,blocker
2381,Release Notes for 2.20.7,blocker
2382,"Update Release Info pages for 3.2rc2, 3.0.6, 2.22.6, and 2.20.7",blocker
2383,"News & Release Announcement for 3.2rc2, 3.0.6, 2.22.6, and 2.20.7",blocker
2384,Release Bugzilla 3.2,blocker
2386,Project names having dashes in them do not work,minor
2387,"Binary attachments, graphical reports and new charts are not displayed correctly on Windows",major
2388,Marking bugs duplicate got a lot more annoying,minor
2389,Some fields have no description in the user auto-completion form,minor
2390,"End tag of ""<kbd>docs/xml</li>"" should be kbd in pages/release-notes.html.tmpl",minor
2391,<select> is not escaped in the API documentation,minor
2392,Dependency list output differs from Dependency Graph,minor
2393,News & Release Announcement for 3.2,blocker
2394,Status Update for 3.2,blocker
2395,The Commit button is too far on the right,minor
2396,"Any search cannot be saved, pressing ""remember search"" results in ""The page cannot be displayed """,major
2397,Editing attachments doesn't update the Last-Modified timestamp,minor
2398,"Release Bugzilla 3.3.2, 3.2.1, 3.0.7, and 2.22.7",blocker
2401, -d $dir check in add_language_set should not be commented-out,minor
2402,Email sending doesn't work if you save a template with DOS newlines,major
2403,Login fails if the users LDAP account is denied search in LDAP,minor
2404,SOAP::Lite versions greater than 0.68 and less than 0.710.06 return the wrong XML for methods,major
2405,"Security Advisory for Bugzilla 3.3.2, 3.2.1, 3.0.7 and 2.22.7",blocker
2406,OS sniffing doesn't detect OS X 10.5,minor
2407,Life cycle diagram still shows that reassigning a bug changes its status to NEW,minor
2409,"On windows, export bug list to CSV breaks because of extra line breaks",major
2410,Bugzilla Installer is no longer available,trivial
2411,Query sorting by multiple columns sometimes loses a column,minor
2412,colgroup in table.html.tmpl not well supported,minor
2413,The mod_perl CGI requirement isn't necessary anymore,minor
2414,$type_id is no longer in use in Search.pm,trivial
2415,"Update the Download, Changes, and Docs pages for 3.3.2, 3.2.1, 3.0.7, and 2.22.7",blocker
2416,"Release Info, Download, Changes, and Docs Page for Bugzilla 3.3.1",blocker
2417,Release Notes for Bugzilla 3.2.1,blocker
2418,Release Notes for 3.0.7,blocker
2419,Release Notes for 2.22.7,blocker
2420,Release Bugzilla 3.3.1,blocker
2421,Update News Page and write Release Announcement for Bugzilla 3.3.1,blocker
2422,"summarized timetracking data line layout is quite ""heavy""",trivial
2425,checksetup.pl should check for DateTime::TimeZone,major
2426,Ignore undefined values when committing user pref changes,minor
2428,"Collapse All does not collapse Description if Preferences set to ""newest-oldest with description at top""",minor
2429,"Non-working link ""File a new bug in the 'Core,Firefox,Toolkit' product"" shown at the bottom of bug list",minor
2430,Change columns: empty buttons when images turned off,minor
2431,The [details] string is duplicated when replying to a comment containing a link to an attachment,trivial
2432,OS sniffing doesn't detect Windows 7,minor
2433,"""Accept bug"" command referenced in whineatnews but doesn't exist",minor
2434,[SECURITY] Calling srand() at startup time in mod_perl makes the same token be generated over and over,critical
2435,"Emergency Release: 3.2.2, 3.0.8, and 3.3.3",blocker
2436,[SECURITY] Editing attachments doesn't have any CSRF protection,major
2437,$self->url is sometimes undefined in Bugzilla::CGI::new,minor
2438,Release Notes for Bugzilla 3.2.2,blocker
2439,Release Notes for Bugzilla 3.0.8,blocker
2440,"Security Advisory for 3.2.2, 3.0.8, and 3.3.3",blocker
2441,Rich clients unable to update bugs need security token included in bug xml,major
2442,importxml.pl crashes when importing bugs (Date::Parse::strptime() leaves seconds undefined in some cases),critical
2443,Rename some of the token names used in attachment.cgi,minor
2445,md5_hex() fails if a saved search has UTF8 characters in it,critical
2446,[Oracle] Search doesn't work because of sql_string_until,major
2447,CC's for cloned ticket all on last line of usemenuforusers selection box,minor
2448,You cannot log in immediately after logout,minor
2449,Firefox is unable to pass stored credentials to the mini login form when you have several user accounts,minor
2450,"Incorrect ""not a known field"" error message",minor
2451,"""Bug"" appears raw in ""File a Bug"" on index.cgi",minor
2453,Duplicated words in the error message in importxml.pl when the default product or component doesn't exist,minor
2454,email_in.pl does not recognize signature delimiter when using CRLF line ending,minor
2455,"query of search summary, any substring, ""regexp a"" fails",minor
2456,"[MYSQL] max_allowed_packet is no longer allowed to be modified in session scope, and throws an error if you try in 5.1.31 and newer",major
2458,Release Bugzilla 3.2.3 and 3.3.4,blocker
2459,relogin.cgi now just throws an error by default (should redirect to index.cgi),minor
2460,Security Advisory for Bugzilla 3.2.3 and 3.3.4,blocker
2461,Error message popup on Windows from Oracle module on every checksetup.pl run,major
2462,"Irrelevant username check in the 'Email Addresses, Bug Numbers, and Votes' section if no checkbox is checked",minor
2464,Confirm attachment deletion page puts HTML in <title>,minor
2465,milestone url in products table has NULL default on MySQL,minor
2466,Release Notes for Bugzilla 3.2.3,blocker
2467,Status Update for Bugzilla 3.2.3 and 3.3.4,blocker
2468,News and Release Announcement for Bugzilla 3.2.3 and 3.3.4,blocker
2469,"Update Release Info, Download, Changes, and Docs pages for Bugzilla 3.2.3 and 3.3.4",blocker
2470,importxml.pl must not use format_time() for deadlines,major
2471,"Should not use raw ""Bug"" word in the description of FIELD_TYPE_BUG_ID",minor
2472,JSON webservice does not display errors properly under mod_perl,major
2473,Truncated XML-RPC response (incorrect content-length header),major
2478,Cannot download security-sensitive bug attachments with shift-click,major
2479,Incorrect CSRF protection page after logging in,minor
2480,Sudo sessions no longer require a valid password to impersonate users,critical
2482,"QuickSearch ""+"" operator adds $qsword over and over for @subWords",minor
2483,"Toolbar's ""Help"" is context-sensitive, which can be confusing to users",minor
2484,"UI uses ""Find"" and ""Search"" interchangeably",minor
2485,"""We've made a guess"" note on enter_bug comes *after* the fields it's about",minor
2486,"The word ""Commit"" can be confusing to new users",minor
2487,"The error message shouldn't say ""didn't match anything"" when entering a too short name (when emailsuffix is in use)",minor
2488,[Bugzilla Docs web page] generated documentation (.pdf & .txt) should have last update date info,minor
2489,"Every other query throws ""Invalid column name"" code error",major
2492,Release Bugzilla 3.4rc1 and 3.2.4,blocker
2493,Release Notes for Bugzilla 3.4rc1,blocker
2494,Release Notes for Bugzilla 3.2.4,blocker
2495,Hitting Commit button after adding bug comment results in blank page,major
2496,Crash when trying to file a bug in a closed product,major
2497,Do not pass the same columns twice to the SQL query,minor
2498,Buglist headers are all centered in IE8,trivial
2500,Toggling Add/Don't add attachment doesn't reset JS state,minor
2502,Fix token.cgi transaction handling,minor
2503,add a help link right besides the quicksearch feature,minor
2504,Calling get_text in quoteUrls over and over is very slow (show_bug.cgi page with many comments is slow),major
2508,Cache user objects for Bug::GetComments,minor
2510,buglist.cgi ends up with only login variables after logging in,minor
2512,Security Advisory for Bugzilla 3.2.4 and 3.4rc1,blocker
2513,Email::Send 2.196 has a bug in the SMTP module,major
2514,"Broken URL links to images in ""Bugzilla/docs""",trivial
2515,show_bug.cgi doesn't properly escape <!-- inside bug summary,minor
2516,buglist.cgi: Use of uninitialized value $strs in split at Bugzilla/Search.pm line 1038,minor
2517,Selections are not persistent across submissions in the New Charts UI,minor
2518,add_see_also and remove_see_also don't call check_can_change_field,major
2521,Queries excluding a group finds no bugs (or too few),minor
2522,Inconsistent name of command line option in install-module.pl,trivial
2523,bugzilla login page prevents firefox from auto-completing the username because 'text' type attribute is missing from HTML code of username input field.,minor
2524,Release Bugzilla 3.4,blocker
2526,"Bugzilla checksetup.pl fails on Base class package ""Bugzilla::Field::Choice"" is empty.",critical
2527,"CGIs pass ""target"" to templates, but it gets overwritten by the login form template in the header",minor
2528,[SECURITY] Users can see all products when editing bugs,critical
2529,Release Bugzilla 3.4.1,blocker
2530,Security Advisory for Bugzilla 3.4.1,blocker
2531,Release Notes for Bugzilla 3.4.1,blocker
2532,"Bugzilla admins should not create templates in the ""default"" directory on customization",minor
2533,typo in admin/groups/edit.html.tmpl,trivial
2534,Bug flags are always displayed in the XML view of bugs,minor
2535,Remove duplicated code in flag/list.html.tmpl,trivial
2537,session was mixing when 2 users are logged in Bugzilla,critical
2538,Malformed UTF-8 characters cause Bugzilla to crash,minor
2539,"Some product names can trigger ""Wide character in print at collectstats.pl line 206"" warnings",minor
2540,"Omit ""--- Comment 0"" line for new bugs",minor
2541,checksetup.pl not properly throwing errors when it can't chmod a file,minor
2542,"""Save Changes"" button is no longer aligned with the comment box if you are in the insidergroup",minor
2543,Missing comma in field-descs.none.tmpl,trivial
2544,"Bug reference is not a link when linebreak between ""bug"" and number (comment wrapping breaks autolinkification)",major
2545,[PostgreSQL] Bugzilla should retry a transaction when it fails due to a concurrent update,minor
2546,"Release Bugzilla 3.0.9, 3.2.5, and 3.4.2",blocker
2547,BugMail.pm uses urlbase for dependency notifications despite sslbase is set,minor
2549,"Security Advisory for Bugzilla 3.0.9, 3.2.5, and 3.4.2",blocker
2550,Release Notes for Bugzilla 3.4.2,blocker
2551,Bugzilla::WebService::Server.pm: Failure to check $@ after eval,minor
2552,jobqueue.pl spams syslog with perl warning when failing to send mail,minor
2553,After upgrade to Bugzilla 3.2.4 malformed mails are sent,major
2554,Release Notes for Bugzilla 3.2.5,blocker
2555,Release Notes for Bugzilla 3.0.9,blocker
2556,Security patch in 3.0.9 breaks some WebService Bug.create parameters,critical
2557,"Release Bugzilla 3.0.10, 3.4.3, and 3.5.1",blocker
2558,No get parameters for Log In link when not using JavaScript,minor
2560,auto-detect attachment content-type failure is not reported when creating new bug and adding attachment,minor
2561,PROCESS user-message instead of INCLUDE'ing it,trivial
2562,"The FK for series.creator should have ""ON DELETE CASCADE"" instead of ""SET NULL""",minor
2564,"You cannot set parameters to false values with an ""answers"" file when creating an installation",minor
2565,Release Notes for Bugzilla 3.4.3,blocker
2566,Release Notes for Bugzilla 3.0.10,blocker
2567,"text input fields are different widths on enter_bug.cgi, process_bug.cgi and post_bug.cgi",minor
2568,Bugzilla::Bug->create is case-sensitive for version and target_milestone values,minor
2569,Change columns clears all columns - only ID shows,major
2570,"Upgrade 3.2.3 to 3.4.2 with Oracle ""Checksetup fails with ORA-00905 missing keyword"" Options",major
2571,Infinite redirect loop when viewing an attachment,critical
2572,template-before_process hook causes infinite recursion if it throws an error,major
2573,buglist header is still displayed when there are no bugs in the list,minor
2574,Non-root jobqueue.pl cannot write to data/mailer.testfile,minor
2576,Quoted comments can overflow the comment box,minor
2577,Custom field names having UTF8-characters in them crash Bugzilla,major
2578,Uninitialized value in can_enter_product() due to a missing argument,minor
2579,"Do not duplicate the 'File a new bug in the ""Foo"" product' link when the buglist is empty",minor
2580,"English string ""From update of attachment"" in localized installations",minor
2581,calls to bz_alter_column on FK referenced columns will lose their referenced status in bz_schema unless the REFERENCES hash is included,major
2582,Improve wording of windows registry entry for ScriptInterpreterSource,minor
2583,"bugs.token field changed to varchar(5) by upgrade, should have been left as varchar(16)",minor
2585,Bugzilla::Object->match() shouldn't call _check_field() when the field being passed can be trusted (deserialising the DB schema is slow),minor
2586,"JSON-RPC interface not working at all with JSON-RPC 1.0, because of $params mis-handling",major
2587,Release 3.5.2 and 3.4.4,blocker
2588,Security Advisory for Bugzilla 3.5.2 and 3.4.4,blocker
2589,Release Notes for Bugzilla 3.4.4,blocker
2590,Should notify of maximum password length on registration page,minor
2591,Spilling Reply in the Comments Section,trivial
2592,Whining fails if mail queueing is enabled,critical
2594,"[Windows] Enabling a extension results in ""deep recursion on subroutine"" warnings",critical
2595,Bugzilla.extensions no longer works,major
2596,Single-file extensions will look for their templates in extensions/template/ and libraries in extensions/lib/,minor
2598,"Release Bugzilla 3.5.3, 3.4.5, 3.2.6 and 3.0.11",blocker
2599,"Security Advisory for Bugzilla 3.5.3, 3.4.5, 3.2.6 and 3.0.11",blocker
2600,Can't login to webservice. Deserialization error.,major
2601,May not be able to upgrade to future versions from old versions because of data/nomail migration code,minor
2602,"[PostgreSQL] Using ""Bug ID contains foo"" in boolean charts or ""Exclude bug numbered"" charts crash PostgreSQL 8.3 and newer",major
2603,email address domain filtering is applying to non-email fields in the history,minor
2605,Typo/ wrong word,trivial
2606,Bugzilla interface is very slow when a user is in hundreds of groups,major
2608,Clicking 'reply' shouldn't add anything to my history,minor
2609,The 'Add users to my watch list (comma separated list)' text is linkified but is not a link,trivial
2610,The flag setter should be able to unset a flag even if not in the request group,minor
2611,"""File a new bug"" link not on buglist results even though bugs are all from one product",minor
2612,bugzilla.dtd is not valid,major
2614,[Oracle] During upgrade: ORA-04098: trigger 'BUGS_TIP.PRODUCTS_MILESTONEURL' is invalid and failed re-validation,critical
2615,Release Notes for Bugzilla 3.4.5,blocker
2616,The new duplicates.cgi is somewhat slow on large databases,major
2617,"logging in with bugzìlla@gemal.dk produces ""There is already an account with the login name bugzìlla@gemal.dk.""",minor
2618,bzr to CVS replication broken since we branched,major
2620,describecomponents.cgi only lists enterable products,minor
2621,Bugzilla->input_params is undefined when calling Bugzilla.version and other methods taking no argument,major
2622,Bug.legal_values triggers an insecure dependency in Bugzilla::Field::get_legal_field_values(),major
2623,"Using edit-multiple causes ""To reassign a bug, you must provide an address for the new assignee. """,major
2624,"Closed bugs are always FIXED, in the <select> in the UI",major
2625,show_bug.cgi: Use of uninitialized value,trivial
2626,cannot run tests when using PERL5LIB (e.g. when using local::lib),minor
2627,Bugzilla::Search does not have POD (API docs),minor
2628,A '<th>' tag ends with '</td>' in template/en/default/bug/edit.html.tmpl between lines 438-442.,trivial
2629,"Unclosed <a name> in ""Importance"" header of fields.html",trivial
2630,"When reopening a Resolved Duplicated bug in IE, JS error stops the correct page behavior",major
2631,Extra spaces when copying bug header,trivial
2633,Release Bugzilla 3.6rc1 and 3.4.6,blocker
2634,Release Notes for Bugzilla 3.6rc1,blocker
2636,Wrong parsing of email_in emails if some @field has no data,minor
2637,Sometimes the JSON-RPC interface returns version 1.1 errors to version 1.0 clients,minor
2638,Release Notes for Bugzilla 3.4.6,blocker
2639,XML-RPC WebService returning wrong dateTime format,critical
2640,Unicode install_string strings aren't rendered properly in the web interface,major
2641,People get asked about pg_config by install-module.pl when they aren't using Pg.,major
2642,"""datetime_format_inbound"" not found when calling Bug.search()",major
2643,Displaying bug comments loads users one at a time,minor
2644,config.cgi?ctype=rdf spends most of its time loading flagtypes from the database,major
2645,"We shouldn't be using terms.Bugzilla in the ""please contribute"" message",minor
2647,A new logincookie is created when changing the password or email address instead of reusing the existing one,minor
2648,User.login does not return any cookies under the JSON-RPC WebService,critical
2650,"Quicksearch incorrectly treats - in quotes as negation (e.g. ""-6"")",minor
2651,JSON-RPC errors have newlines in them,minor
2652,"Scrolling down in bug list after ""dates changed between x and y"" in IE leads to error webpage",major
2653,Release Bugzilla 3.6,blocker
2654,Searching Quicksearch using the minus sign operator doesn't work,major
2655,documentation should point to perl.org and not perl.com,minor
2656,Bug bareword on request queue page,trivial
2657,bugzilla-queue initscript returns wrong result code when the daemon isn't running.,minor
2658,DateTime dies if it gets a 0000-00-00 date from the database,minor
2659,Quoting protection broken in QuickSearch again,major
2660,object_before_delete does not work when object is Bugzilla::Classification,minor
2661,Update the 3.6 Release Notes for the final release,blocker
2662,checksetup.pl fails on ALTER DATABASE if database name contains hyphen,minor
2663,"Incorrect ""X votes"" link when viewing a bug",minor
2664,Unused variables in Search.pm,trivial
2666,Old incomplete data warning showing on activity view due to custom field value of '?',minor
2667,[Oracle] whine.pl sets run_next incorrectly due to CURRENT_DATE,minor
2668,"Release Bugzilla 3.7.1, 3.6.1, 3.4.7 and 3.2.7",blocker
2669,Component Description box only displays 3.5 lines (should display at least 4),minor
2670,update to bugzilla 3.6 with Pg backend error in 'Updating bugs_fulltext',minor
2671,Minor typo in Quicksearch help file,trivial
2672,maxattachmentsize = 0 means that you cannot attach any file to bugs,minor
2673,"Do not display deleted attachments in ""View All""",minor
2674,install-module.pl fails to install DateTime with modern versions of Module::Build and CPAN,major
2676,Various warnings thrown by Search.pm: Perl 5.12 complains for lc(undef) and uc(undef),minor
2677,Various warnings thrown when running QA tests with Perl 5.12.0,minor
2678,"Upgrading from 3.4.4 to 3.6 fails with ORA-01400, because group_control_map.entry is NOT NULL and has no DEFAULT at that point",major
2679,Impossible to uncheck boxes in the Email preferences,major
2681,"Advanced searching using ""keyword"" ""contains none"" or ""does not match regex"" field returns incorrect results",major
2682,Milestone URL needs to be removed from documentation,trivial
2683,Invalid Parameter 'in_new_bugmail' error after submitting a new bug,blocker
2685,Comments are no longer displayed,critical
2686,Update the Downloads page to also have Bzr instructions,blocker
2687,Release Notes for Bugzilla 3.6.1,blocker
2688,Release Notes for Bugzilla 3.4.7.,blocker
2689,Release Notes for Bugzilla 3.2.7,blocker
2690,#c0 links have the wrong href,minor
2691,VALIDATOR_DEPENDENCIES doesn't always sort field validation properly,critical
2692,"Security Advisory for Bugzilla 3.7.1, 3.6.1, 3.4.7 and 3.2.7",blocker
2693,"When closing a bug as a duplicate, the error ""There is no field 'dup_id'"" is displayed",critical
2694,Browse page header is not following the other pages pattern,minor
2695,"Argument """" isn't numeric in numeric gt (>) at template/en/default/bug/field-label.html.tmpl line 34",minor
2696,Search.pm - illegal values in bug_status and resolution params not properly handled,minor
2698,Custom Search should be behind a show/hide widget,minor
